{"$schema":"https://json-schema.org/draft/2020-12/schema","$id":"https://contracts.codestra.co/connectors/connector-manifest.v1.schema.json","title":"Codestra Connector Manifest v1","type":"object","additionalProperties":false,"required":["manifest_version","connector_id","display_name","version","cell","repository","enabled_by_default","direct_n8n_access","runtime_binding","authentication","commands","events","webhooks","forbidden_command_prefixes","forbidden_payload_keys","workflow_families"],"properties":{"$schema":{"type":"string"},"manifest_version":{"const":"1.0"},"connector_id":{"type":"string","pattern":"^[a-z0-9]+(?:-[a-z0-9]+)*$"},"display_name":{"type":"string","minLength":1,"maxLength":120},"version":{"type":"string","pattern":"^(0|[1-9][0-9]*)\\.(0|[1-9][0-9]*)\\.(0|[1-9][0-9]*)(?:-[0-9A-Za-z.-]+)?(?:\\+[0-9A-Za-z.-]+)?$"},"cell":{"enum":["core-communications","beyvra-financial","telephony-private"]},"repository":{"type":"string","pattern":"^[A-Za-z0-9_.-]+/[A-Za-z0-9_.-]+$"},"enabled_by_default":{"const":false},"direct_n8n_access":{"const":false},"runtime_binding":{"type":"object","additionalProperties":false,"required":["status","base_url","health_path","operation_path_template"],"properties":{"status":{"enum":["UNVERIFIED_TEMPLATE_ONLY","VERIFIED"]},"base_url":{"type":"string","format":"uri"},"health_path":{"type":"string","pattern":"^/(?!/).+$"},"operation_path_template":{"type":"string","pattern":"^/(?!/).+\\{operation_id\\}.+$"}}},"authentication":{"type":"object","additionalProperties":false,"required":["type","audience","scopes","secret_references"],"properties":{"type":{"enum":["oauth2-client-credentials","mtls","oauth2-plus-mtls"]},"audience":{"type":"string","minLength":1,"maxLength":200},"scopes":{"type":"array","minItems":1,"uniqueItems":true,"items":{"type":"string","minLength":1,"maxLength":160}},"secret_references":{"type":"array","minItems":1,"uniqueItems":true,"items":{"type":"string","pattern":"^[A-Z][A-Z0-9_]{2,127}$"}}}},"commands":{"type":"array","minItems":1,"items":{"$ref":"#/$defs/command"}},"events":{"type":"array","items":{"$ref":"#/$defs/event"}},"webhooks":{"type":"array","items":{"$ref":"#/$defs/webhook"}},"forbidden_command_prefixes":{"type":"array","uniqueItems":true,"items":{"type":"string","pattern":"^[a-z0-9]+(?:[.-][a-z0-9]+)*\\.$"}},"forbidden_payload_keys":{"type":"array","minItems":6,"uniqueItems":true,"items":{"type":"string","minLength":1,"maxLength":100}},"workflow_families":{"type":"array","minItems":1,"uniqueItems":true,"items":{"type":"string","pattern":"^[a-z0-9]+(?:[.-][a-z0-9]+)*$"}},"metadata":{"type":"object"}},"$defs":{"retryPolicy":{"type":"object","additionalProperties":false,"required":["maximum_attempts","initial_backoff_seconds","maximum_backoff_seconds","jitter_ratio","unknown_outcome_requires_readback"],"properties":{"maximum_attempts":{"type":"integer","minimum":1,"maximum":20},"initial_backoff_seconds":{"type":"number","minimum":0,"maximum":3600},"maximum_backoff_seconds":{"type":"number","minimum":0,"maximum":86400},"jitter_ratio":{"type":"number","minimum":0,"maximum":1},"unknown_outcome_requires_readback":{"const":true}}},"command":{"type":"object","additionalProperties":false,"required":["prefix","required_capability","timeout_seconds","readback_required","retry_policy"],"properties":{"prefix":{"type":"string","pattern":"^[a-z0-9]+(?:[.-][a-z0-9]+)*\\.$"},"required_capability":{"type":"string","pattern":"^(?:NONE|[A-Z][A-Z0-9_]*)$"},"timeout_seconds":{"type":"integer","minimum":1,"maximum":300},"readback_required":{"type":"boolean"},"retry_policy":{"$ref":"#/$defs/retryPolicy"}}},"event":{"type":"object","additionalProperties":false,"required":["event_type","direction"],"properties":{"event_type":{"type":"string","pattern":"^[a-z0-9]+(?:[.-][a-z0-9]+)*\\.v[1-9][0-9]*$"},"direction":{"enum":["inbound","outbound"]}}},"webhook":{"type":"object","additionalProperties":false,"required":["endpoint_key","route_path","signature_algorithm","signature_header","timestamp_header","event_id_header","maximum_clock_skew_seconds","maximum_body_bytes","acknowledgement_deadline_seconds","secret_reference"],"properties":{"endpoint_key":{"type":"string","pattern":"^[a-z0-9]+(?:-[a-z0-9]+)*$"},"route_path":{"type":"string","pattern":"^/(?:v1/webhooks|internal/v1/adapters)/"},"signature_algorithm":{"const":"hmac-sha256"},"signature_header":{"type":"string","pattern":"^[A-Za-z0-9-]{1,100}$"},"timestamp_header":{"type":"string","pattern":"^[A-Za-z0-9-]{1,100}$"},"event_id_header":{"type":"string","pattern":"^[A-Za-z0-9-]{1,100}$"},"maximum_clock_skew_seconds":{"type":"integer","minimum":30,"maximum":900},"maximum_body_bytes":{"type":"integer","minimum":1,"maximum":10485760},"acknowledgement_deadline_seconds":{"type":"integer","minimum":1,"maximum":30},"secret_reference":{"type":"string","pattern":"^[A-Z][A-Z0-9_]{2,127}$"}}}}}
