{"$schema":"https://contracts.codestra.co/connectors/connector-manifest.v1.schema.json","manifest_version":"1.0","connector_id":"odoo-19","display_name":"Odoo 19 CRM","version":"1.0.0","cell":"core-communications","repository":"appolon1908-hue/Odoo","enabled_by_default":false,"direct_n8n_access":false,"runtime_binding":{"status":"UNVERIFIED_TEMPLATE_ONLY","base_url":"https://odoo.internal.invalid","health_path":"/health","operation_path_template":"/v1/operations/{operation_id}/status"},"authentication":{"type":"oauth2-plus-mtls","audience":"codestra-middleware-api","scopes":["connector.odoo-19.command","connector.odoo-19.read"],"secret_references":["CONNECTOR_ODOO_19_CLIENT_SECRET","CONNECTOR_ODOO_19_MTLS_CERT"]},"commands":[{"prefix":"crm.","required_capability":"ODOO_WRITE","timeout_seconds":30,"readback_required":true,"retry_policy":{"maximum_attempts":5,"initial_backoff_seconds":2,"maximum_backoff_seconds":120,"jitter_ratio":0.2,"unknown_outcome_requires_readback":true}}],"events":[{"event_type":"crm.record.changed.v1","direction":"inbound"},{"event_type":"crm.activity.changed.v1","direction":"inbound"}],"webhooks":[{"endpoint_key":"odoo-events","route_path":"/internal/v1/adapters/odoo/events","signature_algorithm":"hmac-sha256","signature_header":"X-Odoo-Signature","timestamp_header":"X-Odoo-Timestamp","event_id_header":"X-Odoo-Event-Id","maximum_clock_skew_seconds":300,"maximum_body_bytes":1048576,"acknowledgement_deadline_seconds":5,"secret_reference":"WEBHOOK_ODOO_HMAC_SECRET"}],"forbidden_command_prefixes":[],"forbidden_payload_keys":["access_token","client_secret","password","private_key","provider_token","refresh_token"],"workflow_families":["crm.odoo","contact-center.followup"],"metadata":{"source_only":true,"runtime_activation_authorized":false,"owner":"odoo-19"}}
