{"$schema":"https://contracts.codestra.co/connectors/connector-manifest.v1.schema.json","manifest_version":"1.0","connector_id":"telnexa-sms","display_name":"Telnexa SMS","version":"1.0.0","cell":"core-communications","repository":"appolon1908-hue/telnexa","enabled_by_default":false,"direct_n8n_access":false,"runtime_binding":{"status":"UNVERIFIED_TEMPLATE_ONLY","base_url":"https://telnexa.internal.invalid","health_path":"/health","operation_path_template":"/v1/operations/{operation_id}/status"},"authentication":{"type":"oauth2-plus-mtls","audience":"codestra-middleware-api","scopes":["connector.telnexa-sms.command","connector.telnexa-sms.read"],"secret_references":["CONNECTOR_TELNEXA_SMS_CLIENT_SECRET","CONNECTOR_TELNEXA_SMS_MTLS_CERT"]},"commands":[{"prefix":"sms.","required_capability":"SMS_DELIVERY","timeout_seconds":30,"readback_required":true,"retry_policy":{"maximum_attempts":5,"initial_backoff_seconds":2,"maximum_backoff_seconds":120,"jitter_ratio":0.2,"unknown_outcome_requires_readback":true}}],"events":[{"event_type":"sms.message.delivered.v1","direction":"inbound"},{"event_type":"sms.message.failed.v1","direction":"inbound"},{"event_type":"sms.inbound.received.v1","direction":"inbound"},{"event_type":"sms.recipient.opted-out.v1","direction":"inbound"}],"webhooks":[{"endpoint_key":"jasmin-events","route_path":"/v1/webhooks/sms/jasmin","signature_algorithm":"hmac-sha256","signature_header":"X-Jasmin-Signature","timestamp_header":"X-Jasmin-Timestamp","event_id_header":"X-Jasmin-Event-Id","maximum_clock_skew_seconds":300,"maximum_body_bytes":1048576,"acknowledgement_deadline_seconds":5,"secret_reference":"WEBHOOK_JASMIN_HMAC_SECRET"}],"forbidden_command_prefixes":[],"forbidden_payload_keys":["access_token","client_secret","password","private_key","provider_token","refresh_token"],"workflow_families":["messaging.telnexa"],"metadata":{"source_only":true,"runtime_activation_authorized":false,"owner":"telnexa-sms"}}
